{
  "$schema": "./schema/sources.schema.json",
  "registry_version": "0.1.1",
  "updated": "2026-07-07",
  "tou_sweep": "compliance/tou-sweep-2026-07/00-sweep-summary.md",
  "fetch_defaults": {
    "user_agent": "TheLLMReportBot/1.0 (+https://thellmreport.com/bot)",
    "user_agent_rotation": "forbidden — single identified UA, never rotated",
    "conditional_get": true,
    "backoff": "exponential",
    "max_polls_per_hour_per_page": 1,
    "schedule_jitter": true,
    "robots_recheck_default": "every-cycle",
    "never_circumvent_bot_walls": "no proxy rotation, no fingerprint spoofing, ever [V-Q3 cond. 1]",
    "structured_endpoints_first": "HTML only for docs pages with no API [V-Q3 cond. 2]",
    "probe_accounts": "dedicated probe-only API accounts per provider, isolated from everything else [V-Q3 cond. 6]",
    "website_auth": "never authenticate on any website host (OpenAI, Anthropic, Mistral explicit per sweep §2.4)",
    "archives": "verbatim fetch archives private; sha256 manifests public",
    "content_flags": ["no-ml-training"],
    "manifest_fields": ["title", "canonical", "redirect_chain"],
    "global_sentinels": [
      "global-bot-wall-revocation",
      "global-uncleared-redirect",
      "global-robots-stance-diff"
    ],
    "audit_log": "request-level (host, timestamp, status, UA, conditional-GET result), rolled up weekly into the public Ledger [V-Q3 cond. 7]"
  },
  "sentinels": {
    "global-bot-wall-revocation": {
      "scope": "all-hosts",
      "trigger": "any 403 / 429 / bot-challenge response",
      "action": "treat as revocation: auto-halt host, escalate to exceptions queue, never circumvent",
      "cadence": "every-fetch"
    },
    "global-uncleared-redirect": {
      "scope": "all-hosts",
      "trigger": "redirect resolving to a host not registered and cleared in this file",
      "action": "suspend source_id; require fresh ToU clearance before re-enable",
      "cadence": "every-fetch"
    },
    "global-robots-stance-diff": {
      "scope": "all-hosts",
      "trigger": "scheduled robots.txt re-fetch diffs a stance change (incl. Content Signals)",
      "action": "open exceptions-queue item on any change [V-Q3 cond. 7]",
      "cadence": "weekly"
    },
    "aws-carveout": {
      "scope": "docs.aws.amazon.com",
      "watch": [
        "https://aws.amazon.com/terms/ — Site Terms CC BY-SA 4.0 documentation carve-out sentence",
        "https://aws.amazon.com/aup/ — AWS Acceptable Use Policy"
      ],
      "fetch_via": "wayback-default; direct only on counsel sign-off (sweep dissent B2)",
      "trigger": "carve-out sentence removed or modified, or AUP change (sweep dissents B1/B3)",
      "action": "verdict lapses to EXCLUDE: mark all docs.aws.amazon.com sources excluded=true; collector auto-switches to aws-bedrock-listfoundationmodels lifecycle fields + aws-bedrock-pricelist-api diffs; no GitHub fallback (awsdocs Bedrock mirrors retired 2023)",
      "cadence": "weekly"
    },
    "aws-bedrock-robots-halt": {
      "scope": "docs.aws.amazon.com",
      "trigger": "robots.txt disallows any /bedrock/ path",
      "action": "auto-halt all docs.aws.amazon.com collection",
      "cadence": "every-cycle"
    },
    "anthropic-canonical-drift": {
      "scope": "platform.claude.com",
      "trigger": "host or canonical-URL drift on pinned pages; change in /docs/en/release-notes/api 307-alias behavior",
      "action": "log full redirect chain every fetch; alert on host/canonical drift (sweep §2.2)",
      "cadence": "every-fetch"
    },
    "google-cross-host-redirect": {
      "scope": "ai.google.dev, cloud.google.com",
      "trigger": "cross-host redirect (e.g. docs.cloud.google.com migration)",
      "action": "treat as new-host event: suspend source + fresh clearance (sweep §2.4)",
      "cadence": "every-fetch"
    },
    "mistral-legal-hub-watch": {
      "scope": "legal.mistral.ai",
      "trigger": "new policy document appears on the hub (can appear without a robots.txt change)",
      "action": "open exceptions-queue item; route new document to ToU clearance (sweep §2.3)",
      "cadence": "weekly"
    },
    "xai-content-signals": {
      "scope": "docs.x.ai, x.ai",
      "trigger": "Content-Signal change (current stance: docs.x.ai ai-train=no, ai-input=yes; x.ai ai-input=no)",
      "action": "honor immediately; ai-input=no means deterministic pipeline only, no LLM ingestion at any stage; open exceptions-queue item on change",
      "cadence": "every-cycle"
    }
  },
  "sources": [
    {
      "source_id": "openai-models-docs",
      "url": "https://developers.openai.com/api/docs/models",
      "method": "GET",
      "auth": "none",
      "class": "provider-docs",
      "lineage": "provider-primary",
      "cadence": "hourly",
      "failover": "openai-models-api",
      "entitlement_caveat": null,
      "tou_ref": "compliance/tou-sweep-2026-07/openai.md",
      "excluded": false,
      "conditions": {
        "robots_recheck": "every-cycle",
        "attribution": "none",
        "never_authenticate": true,
        "notes": "developers.openai.com robots.txt permits (sweep verdict CONDITIONAL); Services Agreement entity-separation condition pending (sweep open item 2)."
      }
    },
    {
      "source_id": "openai-models-api",
      "url": "https://api.openai.com/v1/models",
      "method": "GET",
      "auth": "header:Authorization",
      "class": "official-api",
      "lineage": "provider-primary",
      "cadence": "hourly",
      "failover": "openrouter-models",
      "entitlement_caveat": "models list is account/tier-scoped; absence ≠ retirement (§1.4 rule c carve-out)",
      "tou_ref": "compliance/tou-sweep-2026-07/openai.md",
      "excluded": false,
      "conditions": {
        "robots_recheck": "every-cycle",
        "attribution": "none",
        "notes": "Dedicated probe-only API account [V-Q3 cond. 6]."
      }
    },
    {
      "source_id": "openai-changelog",
      "url": "https://developers.openai.com/api/docs/changelog",
      "method": "GET",
      "auth": "none",
      "class": "provider-docs",
      "lineage": "provider-primary",
      "cadence": "hourly",
      "failover": null,
      "entitlement_caveat": null,
      "tou_ref": "compliance/tou-sweep-2026-07/openai.md",
      "excluded": false,
      "conditions": {
        "robots_recheck": "every-cycle",
        "attribution": "none",
        "never_authenticate": true
      }
    },
    {
      "source_id": "openai-status-summary",
      "url": "https://status.openai.com/api/v2/summary.json",
      "method": "GET",
      "auth": "none",
      "class": "statuspage",
      "lineage": "provider-primary",
      "cadence": "hourly",
      "failover": "openai-status-incidents",
      "entitlement_caveat": null,
      "tou_ref": "compliance/tou-sweep-2026-07/openai.md",
      "excluded": false,
      "conditions": {
        "robots_recheck": "every-cycle",
        "attribution": "none"
      }
    },
    {
      "source_id": "openai-status-incidents",
      "url": "https://status.openai.com/api/v2/incidents.json",
      "method": "GET",
      "auth": "none",
      "class": "statuspage",
      "lineage": "provider-primary",
      "cadence": "hourly",
      "failover": null,
      "entitlement_caveat": null,
      "tou_ref": "compliance/tou-sweep-2026-07/openai.md",
      "excluded": false,
      "conditions": {
        "robots_recheck": "every-cycle",
        "attribution": "none"
      }
    },
    {
      "source_id": "openai-com",
      "url": "https://openai.com/",
      "method": null,
      "auth": "none",
      "class": "provider-docs",
      "lineage": "provider-primary",
      "cadence": null,
      "failover": null,
      "entitlement_caveat": null,
      "tou_ref": "compliance/tou-sweep-2026-07/openai.md",
      "excluded": true,
      "exclusion_reason": "403 WAF — never fetch (design.md §1.3 matrix); never circumvent [V-Q3 cond. 1]. Carve-out: /policies/* compliance sources are registered as policy-page records fetched via Wayback only.",
      "conditions": {
        "match_scope": "host"
      }
    },
    {
      "source_id": "anthropic-models-docs",
      "url": "https://platform.claude.com/docs/en/docs/about-claude/models/overview",
      "method": "GET",
      "auth": "none",
      "class": "provider-docs",
      "lineage": "provider-primary",
      "cadence": "hourly",
      "failover": "anthropic-models-api",
      "entitlement_caveat": null,
      "tou_ref": "compliance/tou-sweep-2026-07/anthropic.md",
      "excluded": false,
      "conditions": {
        "robots_recheck": "every-cycle",
        "attribution": "none",
        "never_authenticate": true,
        "skip_paths": ["/api/*"],
        "sentinels": ["anthropic-canonical-drift"],
        "notes": "robots.txt re-check cap ≤24h per sweep §2.4 (hourly every-cycle satisfies it); never fetch /api/* on platform.claude.com; never authenticate (sweep §2.2)."
      }
    },
    {
      "source_id": "anthropic-models-api",
      "url": "https://api.anthropic.com/v1/models",
      "method": "GET",
      "auth": "header:x-api-key",
      "class": "official-api",
      "lineage": "provider-primary",
      "cadence": "hourly",
      "failover": null,
      "entitlement_caveat": "models list is account/tier-scoped; absence ≠ retirement (§1.4 rule c carve-out)",
      "tou_ref": "compliance/tou-sweep-2026-07/anthropic.md",
      "excluded": false,
      "conditions": {
        "robots_recheck": "every-cycle",
        "attribution": "none",
        "notes": "Dedicated probe-only API account [V-Q3 cond. 6]."
      }
    },
    {
      "source_id": "anthropic-changelog",
      "url": "https://platform.claude.com/docs/en/release-notes/overview",
      "method": "GET",
      "auth": "none",
      "class": "provider-docs",
      "lineage": "provider-primary",
      "cadence": "hourly",
      "failover": null,
      "entitlement_caveat": null,
      "tou_ref": "compliance/tou-sweep-2026-07/anthropic.md",
      "excluded": false,